{
  "version": "v2",
  "request_id": "pedidos-v2-datos-001",
  "data": [
    {
      "id": 12001,
      "codigo_publico": "00000000-0000-4000-8000-000000000001",
      "fecha_confirmacion": "2026-09-22T14:30:00.123456Z",
      "total": "245.50",
      "sucursal": {
        "id": 3,
        "nombre": "Sucursal sintética 3",
        "tipo": "sucursal"
      },
      "items": [
        {
          "id": 45001,
          "pedido_id": 12001,
          "producto": {
            "id": 8,
            "nombre": "Producto sintético",
            "nombre_ticket": "PROD PRUEBA",
            "unidad_medida": "PIEZA (PZA)",
            "unidad_abreviatura": "PZA",
            "cantidad_por_precio": "1.000"
          },
          "cantidad": "2.000",
          "precio_unitario": "122.75",
          "subtotal": "245.50"
        }
      ]
    }
  ],
  "page": {
    "has_more": false,
    "limit": 100,
    "next_cursor": null,
    "returned": 1
  }
}
